<?xml version="1.0" encoding="UTF-8"?>
<!DOCTYPE page SYSTEM "..\Data\PAWSSKHtmlMapper.dtd">
<?xml-stylesheet type="text/xsl" href="..\Templates\PAWSSKHtmlMapper.xsl"?>
<page id="IPMain" count="9.1.1">
    <title level="2">Phrases simples</title>
   <instruction id="IPMainIntroNotPractical" show="swNotPractical">In this section, we want to handle copular, intransitive, transitive and ditransitive sentences in their basic word order (i.e. not changed by focus, topic, interrogative, or negation constructions).  Inflection and agreement features on verbs, cases when a subject may be missing, auxiliaries, and sentences with passive and other voice changes are also covered.
      <br/>
      <br/>
        The data is in surface form, so the grammar must model surface structure, not the underlying structure before any derivational movement.<br/>
        <br/>
The trees you see will be in an X-bar theory form, as much as is possible for modelling the surface structure without movement.  This means that sentences are Inflectional Phrases (IPs) rather than the traditional S.  The subject usually occupies the specifier position, the head is an inflectional or auxiliary element, and the complement is the VP predicate.  For example, the tree for a transitive sentence in an SVO language, like English will be:
<tree img="TreeDescriptions/PawsIPSVO.png"/>
        <help href="../Help/Cbgbtext.doc#XBarTheory">(Click here to see more on the the IP phrase structure of sentences and X-Bar Theory in general.)</help>
        <br/>
        <br/>
SOV, VOS, and OVS word orders can be handled by taking the mirror image of the appropriate subtrees above.  VSO and OSV word order must have the subject internal to the VP, however, so the flatter structure shown here for VSO word order will be used:
<tree img="TreeDescriptions/PawsIPVSO.png"/>
        <br/>
        <br/>
The basic issues to be dealt with are presented here for your consideration and gathering of appropriate data, then the questions relevant to the basic word order of your language (as determined in section <section number="1">Overall Typology Questions</section>) will deal with the details of setting up the phrase structure rules and lexical features and constraints.
</instruction>
    <introduction id="IPMainIntroPractical" show="swPractical">Dans cette section nous traiterons les phrases copulatives, intransitives, transitives ou ditransitives, dans lesquelles aucun terme n’est  marqué (c’est-à-dire modifié par unede focalisation, de topicalisation, interrogative ou négative). 
        <br/>
        <br/>
        Nous couvrirons aussi les caractéristiques de la flexion et de l’accord des verbes, les cas où le sujet est omis, les verbes auxiliaires, les impératifs, les subjonctifs, les conditionnels ainsi que les constructions passives et d’autres changements de voix.
    </introduction>
    <form section="ip" transparent="yes">
        <br/>
        <buttons>
            <button id="IPMainBack" value="Back" goto="IPContents_fr.htm"/>
            <button id="IPMainNext" value="Next" goto="IPContents_fr.htm"/>
        </buttons>
    </form>
    <showWhen id="swNotPractical">
        <whenValue  element="paws" attr="outputGrammar" value="True"/>
    </showWhen>
    <showWhen id="swPractical">
        <whenValue  element="paws" attr="outputGrammar" value="False"/>
    </showWhen>
</page>
