<?xml version="1.0" encoding="UTF-8"?>
<!DOCTYPE page SYSTEM "..\Data\PAWSSKHtmlMapper.dtd" [
<!ENTITY TechnicalTerms SYSTEM  "TechnicalTerms_fr.xml">
]>
<?xml-stylesheet type="text/xsl" href="..\Transforms\PAWSSKHtmlMapper.xsl"?>
<page id="IPIntran" count="9.6.1">
    <title level="2">Phrases simples – Intransitives et Mouvement</title>
    <introduction>Les phrases simples <technicalTermRef term="ttIntransitive">intransitives</technicalTermRef> n’ont pas de <technicalTermRef term="ttComplements">compléments</technicalTermRef> après le verbe, tels que <example>La fille nage</example>. Les sujets de beaucoup de verbes intransitifs ont des sujets-<technicalTermRef term="ttExperiencer">expérient</technicalTermRef> et non des sujets-<technicalTermRef term="ttAgent">agent</technicalTermRef>, comme par exemple <example>Ma sœur a ri</example>.</introduction>
    <form section="ip">
        <prompt><br/>Les exemples de phrases intransitives dont les verbes ont un sujet-agent que vous avez saisis dans la <section number="1.">Questions générales de typologie – Le système casuel</section> sont repris ici. La première boite contient des exemples dont les sujets sont des syntagmes nominaux et la deuxième contient des sujets pronominaux.</prompt>
       <textBox id="IPExamplesIntranExample"  section="typology" dataItem="intExample" cols="80"/>
       <textBox id="IPExamplesIntranPnExample"  section="typology" dataItem="pnIntExample" cols="80"/>
        <prompt><br/>Les exemples de phrases intransitives dont les verbes ont un sujet-expérient que vous avez saisis dans la <section number="1.">Questions générales de typologie – Le système casuel</section> sont repris ici. La première boite contient des exemples dont les sujets sont des syntagmes nominaux et la deuxième contient des sujets pronominaux.</prompt>
       <textBox id="IPExperiencerIntExample"  section="typology" dataItem="experiencerIntExample" cols="80"/>
       <textBox id="IPExperiencerIntPnExample"  section="typology" dataItem="experiencerPnIntExample" cols="80"/>
       <br/>
       <instruction id="IPIntranExpInstruction" show="swExpNotNo">Since Experiencer subjects are distinct from Agent subjects in your language, add the feature <feature>experiencer</feature> to the verbs which have an Experiencer subject.</instruction>
       <br/>
        <introduction> Les verbes de mouvement contiennent un lieu sous la forme d’un syntagme prépositionel ou postpositionel, ou d’un adverbe. Des exemples français des verbes de mouvement comprennent :</introduction>
       <EnglishExample>
           <exItem label="1.">La jeune fille a traversé la rivière.</exItem>
           <exItem label="2.">Ma mère est allée au magasin.</exItem>
           <exItem label="3.">Mon professeur est venu ici.</exItem>
       </EnglishExample>
        <prompt><br/>Saisissez les exemples avec des verbes de mouvement ici :</prompt>
        <textBox id="IPExamplesMotionExample" dataItem="motionExample" cols="80"/>
        <instruction id="IPIntranInstruction">Partial subcategorization can be done as follows, without entering a feature on every verb: if a particular verb is intransitive and can never have anything but a subject, mark it with the feature <feature>intransitive</feature>.  (Do not consider temporal elements.)  If it is an intransitive motion verb that can have a locative PP or AdvP <span id="IPIntranFollow" show="swHeadInitial">following</span>
            <span id="IPIntranPrecede" show="swHeadFinal">preceding</span> it, add the feature <feature>motion</feature> to its lexical entry.  Since the motion verbs are a small, closed set, the feature must be entered in the lexicon on the appropriate verbs; the default setting is <feature>-motion</feature>.  Also, add the feature <feature>transitive_motion</feature> to any verbs like <example>put</example> which take an object and a locative.  
            Verbs like <example>move</example> can be either intransitive or transitive, so they should have both features <feature>motion transitive_motion</feature>.</instruction>
       <br/>
       <br/><buttons>
            <button id="IPIntranBack" value="Back" goto="IPContents_fr.htm"/>
            <button id="IPIntranNext" value="Next" goto="IPContents_fr.htm"/>
        </buttons>
    </form>
   <showWhen id="swExpNotNo">
     <not/> <whenValue element="typology" attr="caseExperiencer" value="no"/>
   </showWhen>
   <showWhen id="swHeadInitial">
        <whenValue element="typology" attr="wordOrder" value="SVO"/>
        <or/>
        <whenValue element="typology" attr="wordOrder" value="VOS"/>
        <or/>
        <whenValue element="typology" attr="wordOrder" value="VSO"/>
    </showWhen>
    <showWhen id="swHeadFinal">
        <whenValue element="typology" attr="wordOrder" value="SOV"/>
        <or/>
        <whenValue element="typology" attr="wordOrder" value="OVS"/>
        <or/>
        <whenValue element="typology" attr="wordOrder" value="OSV"/>
    </showWhen>
   &TechnicalTerms; 
</page>
