<?xml version="1.0" encoding="UTF-8"?>
<!DOCTYPE page SYSTEM "..\Data\PAWSSKHtmlMapper.dtd" [
<!ENTITY TechnicalTerms SYSTEM  "TechnicalTerms_fr.xml">
]>
<?xml-stylesheet type="text/xsl" href="..\Transforms\PAWSSKHtmlMapper.xsl"?>
<page id="AdvClFeatures" count="13.2">
    <title level="2">Propositions adverbiales – Exemples et Caractéristiques</title>
    <introduction>Nous répétons les exemples d’adverbes temporels avec compléments utilisés dans des phrases complètes cités à la page précédente : </introduction>
   <EnglishExample>
        <exItem label="1.">[Since then], John has been moody.  « [Depuis lors], Jean est de mauvaise humeur. »</exItem>
        <exItem label="2.">John has been home [since last week].  « Jean est à la maison  [depuis la semaine dernière]. »</exItem>
        <exItem label="3.">[Since John has been home from the hospital] he is doing better.  « [Depuis que Jean est rentré de l’hôpital], il se porte mieux. »</exItem>
        <exItem label="4.">John is feeling fine [now that he is home from the hospital].  « Jean se sent bien [maintenant qu’il est rentré de l’hôpital]. »</exItem>
        <exItem label="5.">The dog followed Sue everywhere [when she returned from college].  « Le chien a suivi Suzanne partout  [depuis qu’elle est revenue de l’université]. »</exItem>
        <exItem label="6.">[When she returned from college], the dog followed Sue everywhere.  « [Quand elle est revenue de l’université], le chien a suivi Suzanne partout. »</exItem>
   </EnglishExample>
    <form section="advcl">
        <prompt><br/>Saisissez ici, dans votre langue, des exemples similaires dans lesquelles les propositions adverbiales temporelles sont inclues dans des phrases complètes (simples) :</prompt>
        <textBox id="AdvlClTemporalExample" dataItem="tempSentExample" cols="80"/>
        <br/>
        <radioGroup>
            <groupName dataItem="advOrNPPos" default="unknown" position="yesHeadDiff">RAdvOrNPPos</groupName>
            <prompt>Où se place le complément par rapport à l’adverbe principal, que le complément soit un syntagme adverbial ou nominal, ou un complément de la phrase ou de la proposition ?</prompt>
            <radio id="AdvClAdvOrNPPosBefore" dataValue="before">Avant l’adverbe</radio>
            <radio id="AdvClAdvOrNPPosAfter" dataValue="after">Après l’adverbe</radio>
            <radio id="AdvClAdvOrNPPosEither" dataValue="either">D’un côté ou de l’autre</radio>
        </radioGroup>
        <br/>
        <instruction id="AdvClTemporalInstruction">In the lexicon, add the following features to the adverb entry, in addition to the feature <feature>temporal</feature>.  Note that the first two features can be added to the same entry, and either or both can be added to the other sets of features.
            <ul>
                <li>If the adverb may have another adverb as its complement, add the feature <feature>takes_Adv</feature>.</li>
                <li>If the adverb may have a nominal phrase complement, add the feature <feature>takes_DP</feature>.</li>
                <li>If the adverb may have an IP complement, add the features <feature>sentential_finite_IP</feature>.</li>
                <li id="CompYesOption" show="swCompYes">If the adverb requires a complementizer to be present in its sentential complement (CP), add the feature <feature>sentential_finite_CP</feature> instead.</li>
            </ul>
        </instruction>
        <br/>
        <introduction>En ce qui concerne les syntagmes ou les propositions adverbiaux qui expriment la raison ou le but, nous trouvons des adverbes indépendants, comme <example>therefore/so « ainsi »</example> tout comme des adverbes qui admettent une variété de propositions complément. (Les cas comme <example>for this reason « pour cette raison »</example> devraient fonctionner, sur la base des réponses données dans la section <section number="8">Syntagmes adpositionnels</section>.)
            <br/><br/> Les exemples d’adverbes de raison ou de but qui se construisent avec une proposition complément sont placés [entre crochets] dans les exemples 7-11 :
</introduction>
        <EnglishExample>
            <exItem label="7.">John rushed to the hospital [because Sue was in an accident].   « Jean est allé vite à l’hôpital [parce que Suzanne était dans un accident]. »</exItem>
            <exItem label="8.">[Since Jill said that she likes him], Joe smiles all the time.   « [Puisque Jeanne a dit qu’elle l’aime] Jacques sourit tout le temps. »</exItem>
            <exItem label="9.">Bill rushed to the airport [so that he could see Kay before she left].   « Guillaume est allé vite à l’aéroport [pour qu’il puisse voir Gaby avant qu’elle soit partie]. »</exItem>
            <exItem label="10.">The troops threw grenades at the enemy [in order to escape].   « Les soldats ont lancé des grenades sur l’ennemi [pour qu’ils puissent s’échapper]. »</exItem>
            <exItem label="11.">The troops threw grenades at the enemy [in order for the prisoners to escape].   « Les soldats ont lancé des grenades sur l’ennemi [pour que les prisonniers puissent s’évader]. »</exItem>
        </EnglishExample>
       <instruction id="AdvClReasonIntroNotPractical" show="swNotPractical">In the examples above, <example>because</example> and <example>since</example> take only <technicalTermRef term="ttFinite"/> IP complements and <example>so</example> takes a finite CP complement.  In contrast, <example>in order</example> takes either a <technicalTermRef term="ttNonfinite"/> IP with a subject which is not expressed or a nonfinite CP complement.  This is the same subcategorization as shown for <example>like</example> and <example>hate</example> in <section number="10">Complement Clauses</section>. 
 </instruction>
        <introduction id="AdvClReasonIntroPractical" show="swPractical">Dans les exemples ci-dessus, <example>because « parce que »</example> et <example>since « puisque »</example> prennent seulement des complements phrastiques <technicalTermRef term="ttFinite">finis</technicalTermRef> et <example>so « donc »</example> prend une proposition complétive finie avec un complémentiseur. Par contre <example>pour « in order »</example> prend ou un complément phrastique <technicalTermRef term="ttNonfinite">non-fini</technicalTermRef> avec un sujet coréférentiel nul, ou bien une proposition complétive non-fini avec une conjonction de subordination. Ceci est pareil à la sous-catégorie représentée par <example>like « aimer »</example> et <example>hate « haïr »</example> à la <section number="10">Propositions complétives</section>. 
         </introduction>
        <br/>
        <prompt>Les exemples que vous avez donnés à la <section number="3">Adverbes et Syntagmes adverbiaux</section> sont repris ci-dessous.  Vous pouvez ajouter d’autres exemples sous forme de phrases (simple) complètes.<span id="CompNoSpan" show="swCompNo">  Puisque votre langue n’a pas de conjonctions pour les propositions subordonnées, tous vos exemples ne devraient contenir qu’un complément phrastique.</span></prompt>
        <textBox id="AdvPReasonSentExample" section="advp" dataItem="reasonSentExample" cols="80"/>
        <br/>
        <br/>
        <instruction id="AdvClReasonInstruction">In the lexicon, add the following features to the adverb entry, in addition to the feature <feature>reason</feature>.
            <ul>
                <li>If the adverb may have a finite IP complement, add the feature <feature>sentential_finite_IP</feature>.</li>
                <li id="CompYesOptionReason" show="swCompYes">If the adverb requires a complementizer to be present in its finite sentential complement (CP), add the feature <feature>sentential_finite_CP</feature>.</li>
                <li id="CompYesOptionReason1" show="swCompYes">If the adverb requires either a nonfinite IP with a pro-dropped subject or a nonfinite CP complement (like <example>in order</example> above), add the feature <feature>sentential_-finite</feature>.</li>
            </ul>
            Those that are phrases, like <example>in order</example>, need to be entered in the lexicon as units.  In <tool>FLEx</tool> interlinear, you can link the words together.
            For <tool>CARLAStudio</tool>, use underscores between the words so <tool>Join Compound</tool> will parse them as a single lexical entry within <tool>CARLAStudio</tool>.
        </instruction>
        <br/>
        <buttons>
            <button id="AdvClFeaturesBack" value="Back" goto="AdvClMain.xml"/>
            <button id="AdvClFeaturesNext" value="Next" goto="AdvClTesting.xml" gotoNoGrammar="Contents_fr.htm"/>
        </buttons>
    </form>
   <showWhen id="swCompYes">
      <whenValue element="comp" attr="comp" value="yes"/>
   </showWhen>
   <showWhen id="swCompNo">
      <whenValue element="comp" attr="comp" value="no"/>
   </showWhen>
   <showWhen id="swNotPractical">
        <whenValue  element="paws" attr="outputGrammar" value="True"/>
    </showWhen>
    <showWhen id="swPractical">
        <whenValue  element="paws" attr="outputGrammar" value="False"/>
    </showWhen>
   &TechnicalTerms; 
</page>
